{
  "$schema": "http://json-schema.org/draft-07/schema#",
  "type": "object",
  "properties": {
    "$schema": {
      "type": "string"
    },
    "Count is {counter}": {
      "additionalProperties": false,
      "description": "Variables: {counter}",
      "properties": {
        "ar": {
          "type": "string"
        },
        "es": {
          "type": "string"
        },
        "zh": {
          "type": "string"
        }
      },
      "type": "object"
    },
    "Edit <code>src/index.ts</code> and save to test <code>HMR</code>": {
      "additionalProperties": false,
      "description": "",
      "properties": {
        "ar": {
          "type": "string"
        },
        "es": {
          "type": "string"
        },
        "zh": {
          "type": "string"
        }
      },
      "type": "object"
    },
    "Start building amazing things with Rsbuild.": {
      "additionalProperties": false,
      "description": "",
      "properties": {
        "ar": {
          "type": "string"
        },
        "es": {
          "type": "string"
        },
        "zh": {
          "type": "string"
        }
      },
      "type": "object"
    },
    "Vanilla Rsbuild": {
      "additionalProperties": false,
      "description": "",
      "properties": {
        "ar": {
          "type": "string"
        },
        "es": {
          "type": "string"
        },
        "zh": {
          "type": "string"
        }
      },
      "type": "object"
    }
  },
  "required": [
    "Count is {counter}",
    "Edit <code>src/index.ts</code> and save to test <code>HMR</code>",
    "Start building amazing things with Rsbuild.",
    "Vanilla Rsbuild"
  ],
  "additionalProperties": false
}
